script_id,version,audience_size,episode,order,speaker,text
fortuneteller-sample,A,5-6,night,1,나레이션,별빛 아래로 안개가 얇게 깔린 밤입니다.
fortuneteller-sample,A,5-6,night,2,점쟁이,하늘은 늘 멀리서 먼저 속삭여요. 가까운 사람일수록 더 못 들을 때가 많지요.
fortuneteller-sample,A,5-6,night,3,나레이션,점쟁이는 손바닥 위로 떨어지는 빛을 천천히 훑습니다.
fortuneteller-sample,A,5-6,night,4,점쟁이,오늘은 둘이 나란히 서 있고, 그 뒤에 보이지 않는 그림자가 하나 더 따라붙어 있어요.
fortuneteller-sample,A,5-6,night,5,나레이션,그녀는 설명을 길게 하지 않습니다. 밤하늘은 짧은 말에 더 잘 스며듭니다.
fortuneteller-sample,A,5-6,night,6,전환,별은 말이 없고, 밤은 아직 닫히지 않았습니다.
