script_id,version,audience_size,episode,order,speaker,text
undertaker-sample,A,5-6,night,1,나레이션,교회 아래 작은 방에는 촛불만 낮게 흔들리고 있습니다.
undertaker-sample,A,5-6,night,2,장의사,죽은 뒤에야 남는 말이 있어요. 살아 있을 때는 다들 너무 빨리 덮어 버리거든요.
undertaker-sample,A,5-6,night,3,나레이션,장의사는 천천히 장갑을 벗습니다. 오늘 밤은 누구의 이름보다, 누구의 침묵이 길었는지를 떠올립니다.
undertaker-sample,A,5-6,night,4,장의사,마을 사람들 말이 제각각이어도 괜찮아요. 마지막에 남는 건 늘 비슷하니까요.
undertaker-sample,A,5-6,night,5,나레이션,그는 묵직한 종이 묶음을 한 번 쓸어봅니다. 종이는 거짓을 싣지 못하지만, 거짓의 흔적은 종종 남깁니다.
undertaker-sample,A,5-6,night,6,전환,촛불은 꺼지지 않고, 방은 더 조용해집니다.
